source,text,created_at,retweet_count,favorite_count,is_retweet,id_str
Twitter for iPhone,....paying higher rates than many others when we should be paying less. Tough on our exporters and puts the USA at a competitive disadvantage. Must be the other way around. Should ease and cut rate big. Jerome Powell led Federal Reserve has called it wrong from day one. Sad!,03-03-2020 06:34:02,11500,45646,false,1234728725574561792
Twitter for iPhone,Australia’s Central Bank cut interest rates and stated it will most likely further ease in order to make up for China’s Coronavirus situation and slowdown. They reduced to 0.5% a record low. Other countries are doing the same thing if not more so. Our Federal Reserve has us....,03-03-2020 06:27:46,643,2247,false,1234727146964254721
Twitter for iPhone,Thank you @JackBrewerBSI. We’re with you all the way. The American people know what’s going on they totally get it. Watch what happens in November 2020! Thank you for your continued support. Together we are going to KEEP AMERICA GREAT! #BlackVoicesforTrump https://t.co/ftce8XJ3M0,03-03-2020 04:41:26,15882,51307,false,1234700386453409792
Twitter Media Studio,WOW! Sleepy Joe doesn’t know where he is or what he’s doing. Honestly I don’t think he even knows what office he's running for! https://t.co/454v9GFpgF,03-03-2020 04:23:55,24654,91284,false,1234695977656881154
Twitter for iPhone,The Democrats in the House should propose a very simple one year Payroll Tax cut. Great for the middle class great for the USA!,03-03-2020 04:17:15,17577,83053,false,1234694301734580231
Twitter Media Studio,https://t.co/DFl9I722nr,03-03-2020 04:03:59,11095,38315,false,1234690961948758016
Twitter for iPhone,This is an incredible time for our nation—we are in the midst of the Great American Comeback! Jobs are booming incomes are soaring poverty is plummeting confidence is surging and we have completely rebuilt the awesome power of the U.S. Military. PROMISES MADE PROMISES KEPT! https://t.co/d5RqU1n3Y0,03-03-2020 01:52:34,19003,73034,false,1234657888762765313
Twitter for iPhone,I was thrilled to be back in the Great city of Charlotte North Carolina with thousands of hardworking American Patriots who love our Country cherish our values respect our laws and always put AMERICA FIRST! Thank you for a wonderful evening!! #KAG2020 https://t.co/dNJZfRsl9y,03-03-2020 01:34:50,19217,79781,false,1234653427789070336
Twitter for iPhone,https://t.co/1VZQBfdha2,03-03-2020 01:24:53,10304,40520,false,1234650923210878976
Twitter for iPhone,WOW! Thank you just landed see everyone soon! #KAG2020🇺🇸https://t.co/QGdfIsOp4u,03-02-2020 23:06:03,19221,89447,false,1234615984880640001
Twitter for iPhone,Departing for the Great State of North Carolina! https://t.co/BjnyTnnHUt,03-02-2020 21:47:49,10611,58091,false,1234596295324717060
Twitter for iPhone,They are staging a coup against Bernie!,03-02-2020 21:32:54,27468,150338,false,1234592543821705219
Twitter for iPhone,THANK YOU! https://t.co/fdK2I8Fp2J,03-02-2020 19:55:40,13436,55369,false,1234568071249088513
Twitter for iPhone,Michelle @FischbachMN7 is running for Congress in Minnesota. Michelle will protect the unborn is Strong on Crime &amp; Borders Cutting Taxes your #2A Loves our Military Vets &amp; will stand w/ our Great Farmers. Michelle has my Complete &amp; Total Endorsement! https://t.co/qwz5F64dQn,03-02-2020 19:55:07,9124,29944,false,1234567934141399041
Twitter for iPhone,Congresswoman Kay @GrangerCampaign has worked hard for Texas and been a strong supporter of our #MAGA Agenda. She’s strong on #2A and Securing our Border and is 100% pro-life. Kay has my Complete and Total Endorsement! https://t.co/bJGzIcPnTq,03-02-2020 19:51:43,8759,29811,false,1234567077513572352
Twitter for iPhone,Michelle @FischbachMN7 is running for Congress in Minnesota. Nicole is Strong on Crime and Borders Cutting Taxes your #2A Loves our Military Vets and will stand with our Great Farmers. Michelle has my Complete and Total Endorsement! https://t.co/qwz5F64dQn,03-02-2020 19:49:41,161,503,false,1234566566240489474
Twitter for iPhone,THANK YOU @BillCassidy for all of your support with our #MAGA Agenda. You are doing an outstanding job representing the people of Louisiana &amp; the U.S.A. You have my Complete and Total Endorsement! #KAG2020 https://t.co/zmZZgbnNKc,03-02-2020 19:48:04,7826,28720,false,1234566159774756864
Twitter for iPhone,The only people in favor of Mini Mike continuing with his hapless campaign are me and his political consultants who are getting richer and richer by the day!,03-02-2020 17:01:23,14638,82925,false,1234524212993372160
Twitter for iPhone,.@FoxNews is working hard pushing the Radical Left Do Nothing Democrats. They want to be unlike their competitors @CNN &amp; MSDNC (Comcast) Fair &amp; Balanced. When will they ever learn. The Radical Left never even gave @FoxNews permission to partake in their low rated debates!,03-02-2020 16:43:33,13257,53599,false,1234519726702956545
Twitter for iPhone,....competitive disadvantage. We should be leading not following!,03-02-2020 15:16:34,8978,38350,false,1234497837129457664
Twitter for iPhone,As usual Jay Powell and the Federal Reserve are slow to act. Germany and others are pumping money into their economies. Other Central Banks are much more aggressive. The U.S. should have for all of the right reasons the lowest Rate. We don’t putting us at a.....,03-02-2020 15:16:33,15821,63267,false,1234497829298679809
Twitter for iPhone,Jack Welch former Chairman and CEO of GE a business legend has died. There was no corporate leader like “neutron” Jack. He was my friend and supporter. We made wonderful deals together. He will never be forgotten. My warmest sympathies to his wonderful wife &amp; family!,03-02-2020 14:19:23,15867,82084,false,1234483443712561157
Twitter for iPhone,I was criticized by the Democrats when I closed the Country down to China many weeks ahead of what almost everyone recommended. Saved many lives. Dems were working the Impeachment Hoax. They didn’t have a clue! Now they are fear mongering. Be calm &amp; vigilant!,03-02-2020 12:55:20,36681,161214,false,1234462291652993032
Twitter for iPhone,“Ever since (Mini Mike) Bloomberg’s bad debate performances his support has dropped.” @abcnews  Dropped a lot. Only his highly paid consultants who are laughing all the way to the bank still support him...And by the way he did not poll well as mayor in handling crisis!,03-02-2020 12:42:49,11401,49964,false,1234459143790112770
Twitter for iPhone,I am meeting with the major pharmaceutical companies today at the White House about progress on a vaccine and cure. Progress being made!,03-02-2020 12:26:23,20621,103551,false,1234455007765942273
Twitter for iPhone,“The Democrat Party is a field of lightweights in complete disarray.” @kayleighmcenany @JudgeJeanine,03-02-2020 02:33:02,8587,39247,false,1234305684298227713
Twitter for iPhone,Gallup Poll numbers on the handling of this situation are outstanding the best. Thank you! https://t.co/5Q9JI3Kh9R,03-02-2020 02:31:32,11994,49600,false,1234305307439923201
Twitter for iPhone,Watch Mark Levin interview of Charlie Kirk tonight at 11:00 P.M. on @FoxNews. Amazing!!!  And while you’re at it go get Charlie’s new book “The MAGA Doctrine: The Only Ideas That Will Win the Future”...This is a really GREAT book. Support Charlie Kirk!,03-02-2020 02:12:12,14406,63762,false,1234300444199071744
Twitter for iPhone,Sleepy Eyes Chuck Todd is not at the top of his game! Thank you. https://t.co/xIiZgMAbIK,03-02-2020 01:10:07,7939,32068,false,1234284820576063489
Twitter for iPhone,Sleepy Joe Biden also said that guns killed 150 million Americans last year wants to win Georgia on Super Tuesday (not up) and got his speaking location wrong again! https://t.co/INuGY214xa,03-02-2020 01:07:58,11970,41328,false,1234284276239261696
Twitter for iPhone,Thank you! https://t.co/455lHtzRyz,03-02-2020 00:56:40,12971,53852,false,1234281436070522881
Twitter for iPhone,Thank you. I love you too! https://t.co/4qwFlUHfn7,03-02-2020 00:54:07,19661,91314,false,1234280791791865857
Twitter for iPhone,The Black community brilliantly turned their backs on Mini Mike because they know he is a pandering phony who never did right by them! https://t.co/OERuf0ZKOk,03-02-2020 00:46:51,15842,60082,false,1234278963444375553
Twitter for iPhone,Mini Mike Bloomberg didn’t bring NYC back as he said in his fake ad. It was @RudyGiuliani who brought NYC back and who also with his endorsement got Mini Mike elected (with barely a thank you). A boring mayor who the people couldn’t stand!,03-02-2020 00:08:40,19176,75730,false,1234269356760104961
Twitter for iPhone,Pete Buttigieg is OUT. All of his SuperTuesday votes will go to Sleepy Joe Biden. Great timing. This is the REAL beginning of the Dems taking Bernie out of play - NO NOMINATION AGAIN!,03-01-2020 23:43:34,28733,127515,false,1234263037110083587
Twitter for iPhone,People are disgusted and embarrassed by the Fake News Media as headed by the @nytimes @washingtonpost @comcast &amp; MSDNC @ABC @CBSNews and more. They no longer believe what they see and read and for good reason. Fake News is indeed THE ENEMY OF THE PEOPLE!,03-01-2020 21:13:29,35130,120802,false,1234225268207898627
Twitter for iPhone,“Who better than @RepRatcliffe who got to the bottom of the FISAGATE &amp; RUSSIAGATE HOAX. It makes a lot of sense to put John Ratcliffe in there (DNI).The Senate should quickly approve him. @DevinNunes @MariaBartiromo  John will do a great job for the American people!,03-01-2020 21:00:52,15034,55001,false,1234222094210211846
Twitter for iPhone,A Poll in today’s New York Post says that 77% of “U.S. adults have confidence in their government’s ability to handle the Coronavirus (Number One) compared to other health threats.” 64% for Zika 58% for Ebola. Others way down on list. Our professionals are doing a great job!,03-01-2020 20:17:46,23042,99929,false,1234211248373403648
Twitter for iPhone,The food is GREAT at Sammy’s Mexican Grill in Phoenix Arizona. Congratulations to Betty &amp; Jorge Rivas on doing such a wonderful job. I will try hard to stop by the next time I am in Phoenix. Support Sammy’s! @foxandfriends,03-01-2020 15:11:11,31629,127959,false,1234134094797295617
Twitter for iPhone,Coronavirus: In addition to screening travelers “prior to boarding” from certain designated high risk countries or areas within those countries they will also be screened when they arrive in America. Thank you! @VP @SecAzar @CDCgov @CDCDirector,03-01-2020 13:31:59,18025,71404,false,1234109126864707585
Twitter for iPhone,.....a very dark and lonely path! Your reputation will never be the same!,03-01-2020 13:23:38,9077,41686,false,1234107028295077888
Twitter for iPhone,Mini Mike Bloomberg’s consultants and so-called “advisors”(how did that advice work out? Don’t ask!) are on the “gravy train” and all making a fortune for themselves pushing Mini hard when they knew he never had what it takes. Don’t pay them anymore Mike they led you down....,03-01-2020 13:23:34,14719,69573,false,1234107011614285824
Twitter for iPhone,I would find it hard to believe that failed presidential candidates Tom Steyer or Mini Mike Bloombeg would contribute to the Democrat Party even against me after the way they have been treated - laughed at &amp; mocked. The real politicians ate them up and spit them out!,03-01-2020 05:39:39,18722,91521,false,1233990259802767360
Twitter for iPhone,Tom Steyer who other than Mini Mike Bloomberg spent more dollars for NOTHING than any candidate in history quit the race today proclaiming how thrilled he was to be a part of the the Democrat Clown Show. Go away Tom and save whatever little money you have left!,03-01-2020 05:30:08,16502,79939,false,1233987865350148097
Twitter for iPhone,Congratulations to Sleepy Joe Biden!,03-01-2020 04:49:32,11467,79516,false,1233977649552384005
Twitter for iPhone,Democrats are working hard to destroy the name and reputation of Crazy Bernie Sanders and take the nomination away from him!,03-01-2020 04:45:36,16679,91103,false,1233976658572566529
Twitter for iPhone,Sleepy Joe Biden’s victory in the South Carolina Democrat Primary should be the end of Mini Mike Bloomberg’s Joke of a campaign. After the worst debate performance in the history of presidential debates  Mini Mike now has Biden split up his very few voters taking many away!,03-01-2020 00:16:33,18523,90623,false,1233908953026908161
Twitter for iPhone,THE BEST IS YET TO COME! https://t.co/C0RicMRP0Z,02-29-2020 23:42:15,28070,92244,false,1233900317923672064
Twitter for iPhone,Dana you are the real deal! https://t.co/nAGDnP1RDp,02-29-2020 23:10:24,24358,103628,false,1233892301791023106
Twitter for iPhone,THANK YOU @CPAC! #CPAC2020 https://t.co/Qf2zIk0FOj,02-29-2020 23:02:38,8947,36174,false,1233890347220164610
Twitter for iPhone,https://t.co/C2LaKLBxgg,02-29-2020 23:00:54,9186,34603,false,1233889914233786369
Twitter for iPhone,https://t.co/vVSkTSlM1X,02-29-2020 22:58:19,8397,32127,false,1233889261977587718
Twitter for iPhone,I will be having a 1:30 P.M. Press Conference at the White House to discuss the latest CoronaVirus developments. Thank you!,02-29-2020 17:02:35,21282,118643,false,1233799741630230530
Twitter for iPhone,THANK YOU SOUTH CAROLINA! https://t.co/7i5BYCQfg8,02-29-2020 16:19:16,17969,82745,false,1233788838755151872
Twitter Media Studio,https://t.co/REhbRVEcC0,02-29-2020 03:42:38,11298,36829,false,1233598424366403584
Twitter Media Studio,https://t.co/L00A2IM766,02-29-2020 03:39:20,11909,38985,false,1233597596511490048
Twitter for iPhone,South Carolina was GREAT. A BIG &amp; REALLY ENTHUSIASTIC CROWD!,02-29-2020 03:25:32,15146,90256,false,1233594120666566657
Twitter for iPhone,A so-called reporter named @JohnJHarwood who bombed so badly in the 2016 Presidential Debates that I thought he was going to be immediately fired (a Mini Mike type performance) is now with Fake News @CNN. A total loser!,02-29-2020 03:00:18,13060,59154,false,1233587771513507840
Twitter for iPhone,I hope we can get Admiral @RonnyJackson4TX of Texas who served our Country so well into the runoff election in #TX13! Ronny is strong on Crime and Borders GREAT for our Military and Vets and will protect your #2A. Get out and vote for Ronny on Tuesday March 3rd!,02-29-2020 02:43:24,17115,58421,false,1233583517117775872
Twitter for iPhone,Thank you to all of the incredible Law Enforcement Officers in South Carolina tonight. We love you! https://t.co/yoqjwFzqQA,02-29-2020 02:00:33,25798,129688,false,1233572737551159297
Twitter for iPhone,It was my great honor to be back in South Carolina tonight with thousands of hardworking American Patriots who believe in Faith Family God and Country. Thank you for a beautiful evening! #KAG2020 https://t.co/5vZKXLQFO3,02-29-2020 01:58:27,16726,65736,false,1233572208020205568
Twitter for iPhone,I am pleased to announce the nomination of @RepRatcliffe (Congressman John Ratcliffe) to be Director of National Intelligence (DNI). Would have completed process earlier but John wanted to wait until after IG Report was finished. John is an outstanding man of great talent!,02-28-2020 22:24:23,26058,96086,false,1233518334282489861
Twitter for iPhone,On my way to the Great State of South Carolina. See everyone soon! #MAGA #KAG https://t.co/cjzElGNyDN,02-28-2020 22:20:09,13282,57109,false,1233517271110180864
Twitter for iPhone,Nobody fights harder for Montana than @SteveDaines. Steve is a close friend of mine a STRONG Conservative and a tremendous supporter of our #MAGA Agenda. He is strong on Crime &amp; Borders GREAT for our Military &amp; Vets &amp; will protect your #2A. Steve has my Complete Endorsement!,02-28-2020 21:01:05,10852,41419,false,1233497372577148935
Twitter for iPhone,The Dems are working hard to take the prized nomination away from Bernie. Back room politics which Bernie is not very good at. His people will not let it happen again!,02-28-2020 20:28:00,13416,65042,false,1233489045520625664
Twitter for iPhone,Mini Mike is getting slammed. His debates were perhaps the worst in presidential debating history. A total phony who disavowed “Stop &amp; Frisk” after swearing by it for years and even recently. He horribly overused it &amp; then dropped when running as a Dem. A total phony!,02-28-2020 20:25:06,15756,69628,false,1233488317049602048
Twitter for iPhone,We strongly stand with Terrence! https://t.co/N4uFExD6Vz,02-28-2020 20:03:18,26443,81753,false,1233482829767507968
Twitter for iPhone,https://t.co/xbuiZAdsR7 https://t.co/dv2txSp3ro,02-28-2020 19:31:19,12789,47260,false,1233474782026436611
Twitter for iPhone,“You go around Pennsylvania and you see Trump signs everywhere. The Donald Trump situation is bigger than the Reagan Revolution. Donald Trump has inspired us.” @RjHarris15  WHP580,02-28-2020 15:30:09,14015,57284,false,1233414091353489408
Twitter for iPhone,Worst Polls just like in 2016 when they were so far off the mark are the @FoxNews Polls. Why doesn’t Fox finally get a competent Polling Company?,02-28-2020 15:24:01,13375,66468,false,1233412547958755329
Twitter for iPhone,To the people of South Carolina Tom Steyer is a joke laughed at by everyone a total incompetent. He made money in coal now he “hates” coal. Did you see him fawning over Crazy Bernie? Has no chance a loser for South Carolina doesn’t deserve your vote!,02-28-2020 14:54:51,18676,93228,false,1233405207217876992
Twitter for iPhone,Will be in the Great State of South Carolina tonight 7:00 P.M. for a really BIG Rally. Best place to be is a Trump Rally. See you later!,02-28-2020 14:46:31,16022,76247,false,1233403109038346246
Twitter for iPhone,“Federal Court Deals Major Blow To Sanctuary Cities.” @FoxNews  In other words there will be no more Federal Tax Dollars to States &amp; Cities that will not cooperate with Federal Law Enforcement (ICE). This is BIG NEWS! Funds will be cut off immediately. MAKE AMERICA GREAT AGAIN!,02-28-2020 06:13:04,32065,114616,false,1233273894032871424
Twitter for iPhone,The Do Nothing Democrats were busy wasting time on the Immigration Hoax &amp; anything else they could do to make the Republican Party look bad while I was busy calling early BORDER &amp; FLIGHT closings putting us way ahead in our battle with Coronavirus. Dems called it VERY wrong!,02-28-2020 05:43:14,21989,89415,false,1233266386291580931
Twitter for iPhone,So the Coronavirus which started in China and spread to various countries throughout the world but very slowly in the U.S. because President Trump closed our border and ended flights VERY EARLY is now being blamed by the Do Nothing Democrats to be the fault of “Trump”.,02-28-2020 05:05:02,34970,159391,false,1233256774964273152
Twitter for iPhone,So nice! https://t.co/rnhymmWJu6,02-28-2020 04:37:43,14195,59219,false,1233249900927868929
Twitter for iPhone,“Diagnosis positive: @CNN is infected with Trump Derangement Syndrome. I’m calling out CNN for irresponsibly politicizing what should be a unifying battle against a virus that doesn’t choose sides.” @trish_regan @FoxNews  Like I say they are Fake News!,02-28-2020 03:41:19,24486,89551,false,1233235705243013122
Twitter for iPhone,Word is that Mini Mike Bloomberg performed so poorly in the two debates that he is thinking about dropping out of the Democrat Primary. The fact is he was not true to himself and the public was able to quickly figure him out. Not a good experience for Mini Mike!,02-28-2020 03:16:28,18055,95240,false,1233229450881445889
Twitter for iPhone,Congratulations and thank you to our great Vice President &amp; all of the many professionals doing such a fine job at CDC &amp; all other agencies on the Coronavirus situation. Only a very small number in U.S. &amp; China numbers look to be going down. All countries working well together!,02-28-2020 02:39:20,21032,98797,false,1233220106324451328
Twitter for iPhone,Do Nothing Democrats were busy wasting their time on the Impeachment Hoax &amp; anything they could do to make the Republican Party look bad while I was busy calling early boarder &amp; flight closings putting us way ahead in our battle with the Coronavirus. Dems called it very wrong!,02-28-2020 02:32:10,15305,59823,false,1233218304271167489
Twitter for iPhone,“Anti-Trump Network @CNN doing whatever it can to stoke a national Coronavirus panic. The far left Network pretty much ignoring anyone who they interview who doesn’t blame President Trump.” @trish_regan @FoxNews Media refuses to discuss the great job our professionals are doing!,02-28-2020 01:53:59,21949,79496,false,1233208695099666433
Twitter for iPhone,https://t.co/2p4WngYWJ4,02-27-2020 13:34:46,14163,50876,false,1233022666749157379
Twitter for iPhone,They spied on my campaign! https://t.co/LpIc3cNBnr,02-27-2020 06:02:56,29158,105301,false,1232908958421131264
Twitter for iPhone,.@RepKevinBrady (R) of Texas-08 loves Texas &amp; our Country. He has been a GREAT Congressman &amp; supporter of #MAGA. Strong on Crime Border Military Vets and your 2A he is the best Tax Cutter in D.C. Kevin has my Complete &amp; Total Endorsement. Vote on March 3rd. Thank you!,02-27-2020 05:21:30,14514,53979,false,1232898529447890944
Twitter for iPhone,https://t.co/dWl6SZqFLZ,02-27-2020 01:51:36,13521,50788,false,1232845709537353729
Twitter for iPhone,Nancy has allowed her District to go down more than any other in the USA! Hardly even recognizable. https://t.co/wnABoOQOVe,02-26-2020 19:02:15,28679,91209,false,1232742691965980673
Twitter for iPhone,My two great friends. Proud of you both! https://t.co/Fo2CLjc9YZ,02-26-2020 16:20:43,21138,102668,false,1232702038208851968
Twitter for iPhone,Eric I can live with that! https://t.co/TtNdK9pg06,02-26-2020 16:17:52,6333,35382,false,1232701323587604484
Twitter for iPhone,Piers I like you too! https://t.co/pUe09YlrY0,02-26-2020 16:15:57,10400,57857,false,1232700838843473921
Twitter for iPhone,Big Rally in the Great State of South Carolina on Friday. See you there!,02-26-2020 13:51:13,18582,91385,false,1232664415637471234
Twitter for iPhone,“Every poll you look at shows that Black support for President Trump is growing.” @RealCandaceO @MariaBartiromo,02-26-2020 13:41:24,12600,58141,false,1232661947558060036
Twitter for iPhone,Big Story Big Win - Except in the Fake News which won’t cover it! https://t.co/reWPi2hc4v,02-26-2020 13:35:32,18864,62675,false,1232660469082664962
Twitter for iPhone,....during a debate). Pocahontas was mean &amp; undisciplined mostly aiming at Crazy Bernie and Mini Mike. They don’t know how to handle her but I know she is a “chocker”. Steyer was a disaster who along with Mini are setting records in $’s per vote. Just give me an opponent!,02-26-2020 13:24:23,12830,56183,false,1232657663701536768
Twitter for iPhone,Crazy chaotic Democrat Debate last night. Fake News said Biden did well even though he said half of our population was shot to death. Would be OVER for most. Mini Mike was weak and unsteady but helped greatly by his many commercials (which are not supposed to be allowed....,02-26-2020 13:24:17,19451,81017,false,1232657640515342336
Twitter for iPhone,I will be having a News Conference at the White House on this subject today at 6:00 P.M. CDC representatives and others will be there. Thank you!,02-26-2020 13:03:27,13623,48095,false,1232652397325037568
Twitter for iPhone,Low Ratings Fake News MSDNC (Comcast) &amp; @CNN are doing everything possible to make the Caronavirus look as bad as possible including panicking markets if possible. Likewise their incompetent Do Nothing Democrat comrades are all talk no action. USA in great shape! @CDCgov.....,02-26-2020 13:03:21,20518,74618,false,1232652371832004608
Twitter for iPhone,Just landed. India was great trip very successful. Heading to the White House. Meetings and calls scheduled today. @CDCgov @SecAzar and all doing a great job with respect to Coronavirus! Briefing this afternoon.,02-26-2020 11:39:45,17818,99298,false,1232631333408649216
Twitter for iPhone,“U.S. acted on the Coronavirus very very quickly.” Gordon Chang  @IngrahamAngle,02-26-2020 07:19:49,11378,54817,false,1232565919043317761
Twitter for iPhone,Thank you! https://t.co/5DNbnbEtyy,02-26-2020 06:52:41,8936,37859,false,1232559088610856960
Twitter for iPhone,Russia wants him to win! https://t.co/bNUeIsqmQX,02-26-2020 06:49:12,6834,28685,false,1232558211103772672
Twitter for iPhone,An absolute disgrace! https://t.co/xwmsyitlMh,02-26-2020 06:47:58,11150,36600,false,1232557903187365889
Twitter for iPhone,52% in the new Rasmussen Poll. 95% Approval Rating in the Republican Party. Thank you!,02-26-2020 02:34:31,25793,140237,false,1232494118137294850
Twitter for iPhone,....Democrats talking point is that we are doing badly. If the virus disappeared tomorrow they would say we did a really poor and even incompetent job. Not fair but it is what it is. So far by the way we have not had one death. Let’s keep it that way!,02-26-2020 02:29:24,15930,67601,false,1232492832897658880
Twitter for iPhone,CDC and my Administration are doing a GREAT job of handling Coronavirus including the very early closing of our borders to certain areas of the world. It was opposed by the Dems “too soon” but turned out to be the correct decision. No matter how well we do however the.....,02-26-2020 02:29:21,25415,109363,false,1232492821501771776
Twitter for iPhone,That is because they cover your favorite President relatively well. @CNN &amp; MSDNC are dying in the ratings! https://t.co/dhlZlbyg2N,02-25-2020 22:36:02,13075,53010,false,1232434103229640704
Twitter for iPhone,No surprise! https://t.co/qCcUPsXgG9,02-25-2020 22:00:07,12599,52242,false,1232425065058164736
Twitter for iPhone,True but we are getting it all done! https://t.co/omwdyyPDAX,02-25-2020 20:52:55,12285,57987,false,1232408152563277824
Twitter for iPhone,A total miscarriage of justice! https://t.co/zHLo1NL9Sb,02-25-2020 20:43:33,12141,45129,false,1232405794592714752
