source,text,created_at,retweet_count,favorite_count,is_retweet,id_str
Twitter for iPhone,The Impeachment Hoax is a massive election interference the likes of which has never been seen before. In just two hours the Radical Left Do Nothing Democrats have seen their phony case absolutely shredded. Shifty is now exposed for illegally making up my phone call &amp; more!,01-26-2020 13:09:34,24376,102106,false,1221419910175301633
Twitter for iPhone,True! https://t.co/uFjcJcxpSC,01-26-2020 04:07:21,10247,39295,false,1221283457004982272
Twitter for iPhone,https://t.co/pbomiDN6z4,01-26-2020 03:10:49,11390,36410,false,1221269233126060033
Twitter for iPhone,All Democrats should watch this! https://t.co/WFK33pR0Lv,01-26-2020 02:15:14,46945,129583,false,1221255245117952000
Twitter for iPhone,وزیر امور خارجه ایران می گوید ایران خواستار مذاکره با ایالات متحده است اما می خواهد که تحریم ها برداشته شود. @FoxNews @OANN   نه، مرسی! https://t.co/fWdjR1DcUc,01-26-2020 01:43:48,17949,68960,false,1221247332529975297
Twitter for iPhone,Iranian Foreign Minister says Iran wants to negotiate with The United States but wants sanctions removed. @FoxNews  @OANN No Thanks!,01-26-2020 00:16:02,25976,110748,false,1221225245220265985
Twitter for iPhone,Previous quote from the great Republican Senator Jim Inhofe of Oklahoma - Chairman of the Senate Armed Services Committee,01-25-2020 22:05:57,8014,37125,false,1221192511139581959
Twitter for iPhone,....at the judges that we have right now.,01-25-2020 21:57:38,10347,49967,false,1221190416201969665
Twitter for iPhone,“You don’t come to court and ask for witnesses after you’ve already presented your case unless you know your case is not working. I think their real motivation is for them to keep this President busy. We’re doing a great job on the economy we’re building our military look.....,01-25-2020 21:57:34,25134,120550,false,1221190398846152708
Twitter for iPhone,Martha is a great leader on this issue! https://t.co/yl5ly5nwdv,01-25-2020 20:46:41,8691,37395,false,1221172563117772800
Twitter for iPhone,Three great men! https://t.co/3W3xqgqgwq,01-25-2020 20:37:23,7719,31006,false,1221170219172945920
Twitter for iPhone,Such a great family! https://t.co/M39vQS5crN,01-25-2020 20:11:45,7383,40404,false,1221163769239392261
Twitter for iPhone,Thank you Nick! https://t.co/hZTLVa2ROU,01-25-2020 19:44:30,20675,103938,false,1221156910730293254
Twitter for iPhone,Any fair minded person watching the Senate trial today would be able to see how unfairly I have been treated and that this is indeed the totally partisan Impeachment Hoax that EVERYBODY including the Democrats truly knows it is. This should never be allowed to happen again!,01-25-2020 18:41:03,31145,138567,false,1221140946320084995
Twitter for iPhone,Our case against lyin’ cheatin’ liddle’ Adam “Shifty” Schiff Cryin’ Chuck Schumer Nervous Nancy Pelosi their leader dumb as a rock AOC &amp; the entire Radical Left Do Nothing Democrat Party starts today at 10:00 A.M. on @FoxNews @OANN or Fake News @CNN or Fake News MSDNC!,01-25-2020 14:37:54,30015,117907,false,1221079753760833536
Twitter for iPhone,“I like President Trump’s Tweets (Social Media) I like everything about him...and this Ukraine stuff the trial the impeachment this isn’t t about Ukraine. Donald Trump has committed the two unpardonable sins in the eyes of the Democrats. He beat Hillary Clinton in 2016 and..,01-25-2020 14:19:35,20930,95876,false,1221075142404644864
Twitter for iPhone,....secondly he is fulfilling every promise he made and that is making his opponents apoplectic. They’re trying to get him out of office and they’re not going to succeed.” Pastor Robert Jeffress author of “Choosing the Extraordinary Life”  Thank you Pastor! @LouDobbs @FoxBus,01-25-2020 14:19:35,14908,65490,false,1221075143117721600
Twitter for iPhone,The Great @LouDobbs: “People know after 3 years of this President the most historic President in our Country’s history that there is no one who can touch what he’s done in 3 years foreign policy domestic policy you name it it’s amazing. Just to have the guts not to be.....,01-25-2020 13:59:34,19060,82594,false,1221070105230094336
Twitter for iPhone,....intimidated by this national left wing media that reduces most politicians and most public figures to whining crying puddles of cowardice - it is really something to have a man in the White House who has a courageous heart and does what he says he will do.”,01-25-2020 13:59:34,12983,57464,false,1221070106043744256
Twitter for iPhone,Check out @seanhannity now on @FoxNews. Big tonight!,01-25-2020 01:59:08,8521,39419,false,1220888803088519173
Twitter for iPhone,A really big show tonight by @seanhannity  9:00 P.M. @FoxNews  Heavy emphasis on the Impeachment Hoax. The Radical Left Do Nothing Democrats have gone crazy. They know it’s a con but just can’t sell it! Public strongly against Impeachment.,01-25-2020 01:49:48,1462,4613,false,1220886453053509633
Twitter for iPhone,It was my honor to welcome our nation’s Mayors to the @WhiteHouse as we continue to strengthen the bonds of cooperation between federal and local governments so that we can deliver great jobs excellent schools affordable healthcare and safe communities for all of our people! https://t.co/QwYzS32lyQ,01-25-2020 00:35:31,11667,50568,false,1220867760361746432
Twitter for iPhone,https://t.co/c1KBtLnbQn https://t.co/ZPoaFDppg2,01-25-2020 00:28:17,26909,96492,false,1220865941434699776
Twitter for iPhone,After consultation with our Great Military Leaders designers and others I am pleased to present the new logo for the United States Space Force the Sixth Branch of our Magnificent Military! https://t.co/TC8pT4yHFT,01-24-2020 21:31:52,41425,176424,false,1220821545746141187
Twitter for iPhone,China has been working very hard to contain the Coronavirus. The United States greatly appreciates their efforts and transparency. It will all work out well. In particular on behalf of the American People I want to thank President Xi!,01-24-2020 21:18:15,22967,124909,false,1220818115354923009
Twitter for iPhone,#MarchForLife https://t.co/5Yg09dOoJd,01-24-2020 18:11:20,22202,75832,false,1220771079234510850
Twitter for iPhone,The Do Nothing Democrats just keep repeating and repeating over and over again the same old “stuff” on the Impeachment Hoax. They want to use up ALL of their time even though it is the wrong thing to do. They ought to go back to work for our great American people!,01-24-2020 16:56:24,28194,133839,false,1220752219601088513
Twitter for iPhone,READ THE TRANSCRIPTS!,01-24-2020 16:16:09,18198,97552,false,1220742093250932736
Twitter for iPhone,More than anything else the Radical Left Do Nothing Democrats like AOC Omar Cryin’ Chuck Nervous Nancy &amp; Shifty Schiff are angry &amp; “deranged” over the fact that Republicans are up to 191 Federal Judges &amp; Two Great New Supreme Court Justices. Don’t blame me blame Obama!,01-24-2020 15:37:32,24173,96831,false,1220732371919626240
Twitter for iPhone,Jim is great! https://t.co/SxjDSlaP7J,01-24-2020 15:11:25,13819,57973,false,1220725799684399104
Twitter for iPhone,Cryin’ Chuck never had what it takes and never will! https://t.co/pQh4lXNCBN,01-24-2020 12:58:27,13293,50549,false,1220692336881160193
Twitter for iPhone,The Impeachment Hoax is interfering with the 2020 Election - But that was the idea behind the Radical Left Do Nothing Dems Scam attack. They always knew I did nothing wrong!,01-24-2020 12:50:09,21152,94893,false,1220690251561213952
Twitter for iPhone,“I often get asked the question well isn’t the President going to be stronger and harder to beat if he survives this? The answer is yes but the Congress has no choice it has a Constitutional responsibility.” Joe Biden pres. candidate. Even Joe agrees with us! @foxandfriends,01-24-2020 12:41:33,12004,59438,false,1220688087220617218
Twitter for iPhone,After having been treated unbelievably unfairly in the House and then having to endure hour after hour of lies fraud &amp; deception by Shifty Schiff Cryin’ Chuck Schumer &amp; their crew looks like my lawyers will be forced to start on Saturday which is called Death Valley in T.V.,01-24-2020 12:37:46,17977,76169,false,1220687131292643329
Twitter for iPhone,....a foreign power engaged in clandestine intelligence activities and yet they still asked for the renewal two more times and it gave the right for the government to rifle through the Trump campaigns files &amp; Emails Text messages.....” So how bad &amp; illegal is that? @FoxNews,01-24-2020 12:35:52,10589,36760,false,1220686655855693824
Twitter for iPhone,Frances Hakes former Federal prosecutor “This is really significant. The FBI had debunked the Steele Dossier in January of 2017 and then even after they did that even after they knew from the CIA &amp; from their own sources they knew that Carter Page was not the agent of,01-24-2020 12:35:51,15239,55443,false,1220686650864390145
Twitter for iPhone,“He’s got to explain this. How did Hunter Biden get a billion and a half dollars (from China) to invest when he’d been in business for 60 days?” @LindseyGrahamSC @FoxNews,01-24-2020 11:42:37,24691,92407,false,1220673252764332037
Twitter for iPhone,“21 State Attorney Generals denouncing the Impeachment of President Trump.” @FoxNews,01-24-2020 11:24:48,11738,56658,false,1220668770638876672
Twitter for iPhone,Jeanne Mancini President March for Life: “We have never had a President of the United States actually come in person to the March for Life.” But now you do! See you later Jeanne. @HeatherChilders @FoxNews,01-24-2020 11:18:36,13215,59558,false,1220667212387815424
Twitter Media Studio,https://t.co/MGwSfC6hC4,01-24-2020 03:48:51,11659,42655,false,1220554025189416960
Twitter Media Studio,https://t.co/QNbBIAKFbk,01-24-2020 03:44:32,10746,37240,false,1220552942538960896
Twitter for iPhone,Carlos will win big very exciting. Great for Florida great for USA! He has my complete and total Endorsement! https://t.co/6Rd5laSEkV,01-24-2020 02:52:47,13552,55310,false,1220539917660381185
Twitter for iPhone,https://t.co/Acyh0HStm8,01-24-2020 02:40:03,82357,348328,false,1220536711031078913
Twitter for iPhone,True! https://t.co/OPTBdNOQrD,01-23-2020 22:21:22,14742,59091,false,1220471611477786624
Twitter for iPhone,That is a real fan. Thank you! https://t.co/1JWyoyiidW,01-23-2020 21:50:02,45346,250117,false,1220463728535252992
Twitter for iPhone,On my way see you soon! https://t.co/6Rd5lbafJv,01-23-2020 21:11:47,10251,44736,false,1220454103937167361
Twitter for iPhone,Crazy Bernie takes the lead in the Democrat Primaries but it is looking more and more like the Dems will never allow him to win! Will Sleepy Joe be able to stumble across the finish line?,01-23-2020 21:08:30,22470,123127,false,1220453276275150855
Twitter for iPhone,Democrats are going to destroy your Social Security. I have totally left it alone as promised and will save it!,01-23-2020 21:08:28,26238,120441,false,1220453267509055490
Twitter for iPhone,A poll of Radical Left Do Nothing Democrats just came out in Florida. Nice results! https://t.co/YYo9CxWsVH,01-23-2020 21:04:47,12736,49225,false,1220452340555309066
Twitter for iPhone,I LOVE ALABAMA! https://t.co/ZDlBDehhvN,01-23-2020 21:03:28,9102,38541,false,1220452007389155328
Twitter for iPhone,Interesting poll in Texas-13! #TX13 https://t.co/80uS2VaPGP,01-23-2020 21:02:31,6329,23931,false,1220451771572785157
Twitter for iPhone,Close race in Kansas! https://t.co/m2ExF9vHKU,01-23-2020 21:01:35,5966,22637,false,1220451535005671428
Twitter for iPhone,“President Trump shows us that electability is no match for electricity” by @KellyannePolls https://t.co/XQBir61WHO,01-23-2020 20:34:14,9431,37995,false,1220444653348098048
Twitter for iPhone,“The Democrats have now conceded that President Trump has not committed a crime.” @AriFleischer,01-23-2020 20:26:23,22255,95209,false,1220442676081963010
Twitter for iPhone,The United States looks forward to welcoming Prime Minister @Netanyahu &amp; Blue &amp; White Chairman @Gantzbe to the @WhiteHouse next week. Reports about details and timing of our closely-held peace plan are purely speculative.,01-23-2020 19:30:13,12361,50901,false,1220428541197799424
Twitter for iPhone,The Democrats don’t want a Witness Trade because Shifty Schiff the Biden’s the fake Whistleblower(&amp; his lawyer) the second Whistleblower (who vanished after I released the Transcripts) the so-called “informer” &amp; many other Democrat disasters would be a BIG problem for them!,01-23-2020 18:18:06,25626,101480,false,1220410391668371457
Twitter for iPhone,“This is all about undermining the next Election.” Liz Peek @FoxNews,01-23-2020 16:15:29,20214,94161,false,1220379537155948544
Twitter for iPhone,Mini Mike Bloomberg is playing poker with his foolhardy and unsuspecting Democrat rivals. He says that if he loses (he really means when!) in the primaries he will spend money helping whoever the Democrat nominee is. By doing this he figures they won’t hit him as hard....,01-23-2020 13:25:14,18056,80875,false,1220336691539599361
Twitter for iPhone,....during his hopeless “presidential” campaign. They will remain silent! The fact is when Mini losses he will be spending very little of his money on these “clowns” because he will consider himself to be the biggest clown of them all - and he will be right!,01-23-2020 13:25:14,11185,49931,false,1220336692378394624
Twitter for iPhone,The Democrats &amp; Shifty Schiff whose presentation to the Senate was loaded with lies and misrepresentations are refusing to state that the Obama Administration withheld aid from many countries including Ukraine Pakistan Philippines Egypt Honduras &amp; Mexico. Witch Hunt!,01-23-2020 12:57:46,22295,76473,false,1220329778810687489
Twitter for iPhone,No matter what you give to the Radical Left Do Nothing Democrats it will never be enough!,01-23-2020 12:54:28,20951,107909,false,1220328946736226305
Twitter for iPhone,The Democrat House would not give us lawyers or not one witness but now demand that the Republican Senate produce the witnesses that the House never sought or even asked for? They had their chance but pretended to rush. Most unfair &amp; corrupt hearing in Congressional history!,01-23-2020 12:52:46,29246,130447,false,1220328518288052225
Twitter for iPhone,In an Impeachment you can’t use a work of fiction as the theory for the case filling in gaps with presumptions against the President. It was a weak presentation self indulgent &amp; he didn’t deliver the goods.” Robert Charles @HeatherChilders @FoxNews,01-23-2020 12:49:16,13997,56753,false,1220327641364029440
Twitter for iPhone,....OF THE 2020 ELECTION BECSUSE IT WEAPONIZES A PROCESS THAT SHOULD ONLY BE INITIATED IN EXCEEDINGLY RARE CIRCUMSTANCES AND SHOULD NEVER BE USED FOR PARTISAN PURPOSES.” @HeatherChilders @FoxNews The Democrats are trying hard to damage Republicans prior to the Election!,01-23-2020 12:46:14,11509,44109,false,1220326875882577921
Twitter for iPhone,Attorney Generals from 21 States are urging the Senate to reject Impeachment. They say the Articles have legal &amp; factual problems and the Democrats case sets a dangerous historical precedent. “EVEN AN UNSUCCESSFUL EFFORT TO IMPEACH THE PRESIDENT UNDERMINES THE INTEGRITY.....,01-23-2020 12:45:53,20546,79103,false,1220326789182033920
Twitter for iPhone,“There is no evidence of a crime.” Robert Charles Fmr Asst Secy of State. The crimes were committed by the other side!,01-23-2020 12:42:08,16800,72155,false,1220325842330537984
Twitter for iPhone,“Schiff doesn’t have a case telling the truth so he’s manufacturing things.” Rush Limbaugh @foxandfriends,01-23-2020 12:39:17,16340,73057,false,1220325126186598400
Twitter for iPhone,Sorry if you come you will be immediately sent back! https://t.co/Ba9kmD6HD0,01-22-2020 22:13:16,26779,105211,false,1220107185276907521
Twitter for iPhone,See you on Friday...Big Crowd! https://t.co/MFyWLG4HFZ,01-22-2020 22:04:40,26255,102712,false,1220105021930426368
Twitter for iPhone,True! https://t.co/VRyCRDe7Ua,01-22-2020 21:43:19,12918,53523,false,1220099650461392896
Twitter for iPhone,“NO PRESSURE”,01-22-2020 19:58:40,21526,128636,false,1220073313768099840
Twitter for iPhone,Will be Great! https://t.co/Ce20fgcM6K,01-22-2020 19:12:11,8662,41504,false,1220061617561300994
Twitter for iPhone,Great working with you Maria! https://t.co/ZUDKeAgcKJ,01-22-2020 19:08:07,8165,38403,false,1220060590703611907
Twitter for iPhone,One of the many great things about our just signed giant Trade Deal with China is that it will bring both the USA &amp; China closer together in so many other ways. Terrific working with President Xi a man who truly loves his country. Much more to come!,01-22-2020 18:03:06,20461,106333,false,1220044230065655808
Twitter for iPhone,Heading back to Washington from @Davos  Switzerland. Very successful (for USA) trip!,01-22-2020 16:21:27,12733,64813,false,1220018651362779136
Twitter for iPhone,“Not the Senate’s job to mop up the mess made in the House by the Democrats. Biden admitted that he went to Ukraine and did the Quid Pro Quo.” @SteveScalise  @FoxNews,01-22-2020 16:17:33,23406,94032,false,1220017667387445248
Twitter for iPhone,THANK YOU @WEF! https://t.co/rQWBqJy7za,01-22-2020 16:01:53,19645,72249,false,1220013726935351296
Twitter for iPhone,They are taking the nomination away from Bernie for a second time. Rigged!,01-22-2020 13:26:39,23650,141545,false,1219974660915388416
Twitter for iPhone,Steyer is a major loser. Just doesn’t get it. This is second time with Bernie! https://t.co/fxZh8zNhks,01-22-2020 13:23:33,7410,33830,false,1219973879692713989
Twitter for iPhone,Big story. Hope Fake News covers it! https://t.co/NCtUYK6Eco,01-22-2020 12:55:53,9473,32928,false,1219966918725074944
Twitter for iPhone,Their case was so “overwhelming” in the House that they need &amp; demand Witnesses in the Senate! https://t.co/XuOMzYSnwv,01-22-2020 12:43:56,11111,42063,false,1219963910620680192
Twitter for iPhone,ENJOY! https://t.co/xqEoCLJy0Y,01-22-2020 09:34:38,6672,9774,false,1219916272441470976
Twitter for iPhone,Will be interviewed at 5:00 A.M. Eastern by @JoeSquawk on @CNBC at the World Economic Forum in Davos Switzerland. Enjoy!,01-22-2020 09:32:48,5157,24345,false,1219915807217659905
Twitter for iPhone,Making great progress in @Davos. Tremendous numbers of companies will be coming or returning to the USA. Hottest Economy! JOBS JOBS JOBS!,01-22-2020 06:48:31,18606,90134,false,1219874467540799488
Twitter for iPhone,Wow! https://t.co/drmhQQ6CL3,01-22-2020 05:29:16,15835,54957,false,1219854522236968961
Twitter for iPhone,READ THE TRANSCRIPTS!,01-21-2020 19:08:04,33010,176163,false,1219698190129225728
Twitter for iPhone,Congratulations on your big @UFC WIN! https://t.co/135dOECsEf,01-21-2020 13:25:01,22228,149188,false,1219611860468670469
Twitter for iPhone,THE BEST IS YET TO COME! https://t.co/YBMOBurdHQ,01-21-2020 01:59:50,41709,136563,false,1219439427488866305
Twitter for iPhone,“It’s about the Economy stupid” except when it comes to Trump. The fact is the Fake News Media hates talking about the Economy and how incredible it is!,01-21-2020 01:45:51,29545,148530,false,1219435907775791104
Twitter for iPhone,Everyone said it couldn’t be done. But for the first time in a generation there will be direct flights between Serbia and Kosovo. Another win. Thanks to @WHNSC Ambassador Robert O’Brien and Ambassador @RichardGrenell! https://t.co/0qSLryG96B,01-21-2020 01:36:43,13986,56784,false,1219433612753289216
Twitter for iPhone,Representative Randy Weber (@TxRandy14) of Texas has been a HUGE supporter of our #MAGA Agenda from the very beginning. Strong on Crime the Border Illegal Immigration the 2nd Amendment and our great Military &amp; Vets! Randy has my Full Endorsement!,01-21-2020 01:26:55,11118,43786,false,1219431143067377664
Twitter for iPhone,Representative John Carter (@JudgeJohnCarter) from the Great State of Texas has been a tremendous supporter of our #MAGA Agenda. He is strong on Crime and Borders great for our Military and our Vets and Strong on our #2A. John has my Complete and Total Endorsement!,01-21-2020 01:26:11,11165,44766,false,1219430958769664002
Twitter for iPhone,Texas Rep Roger Williams (@RepRWilliams) has done an incredible job representing the Great State of Texas. Roger is tough on Crime Strong on the Border &amp; Illegal Immigration. He loves our Military &amp; our Vets and protects our #2A. Roger has my Total &amp; Complete Endorsement!,01-21-2020 01:24:20,11538,47056,false,1219430494460268544
Twitter for iPhone,Heading to Davos Switzerland to meet with World and Business Leaders and bring Good Policy and additional Hundreds of Billions of Dollars back to the United States of America! We are now NUMBER ONE in the Universe by FAR!!,01-21-2020 00:59:38,25441,124316,false,1219424278216470528
Twitter for iPhone,Excellent! https://t.co/5OBYCFQCQo,01-21-2020 00:46:13,11563,52936,false,1219420903047479297
Twitter for iPhone,https://t.co/gbiwDilQAW,01-20-2020 23:32:31,14532,58277,false,1219402353457102850
Twitter for iPhone,Nancy can’t fix it. The Do Nothing Dems have done great harm to our Country! https://t.co/qTDgHgIhy1,01-20-2020 23:03:10,20877,78613,false,1219394967304581120
Twitter for iPhone,I will NEVER allow our great Second Amendment to go unprotected not even a little bit!,01-20-2020 20:12:03,51316,256812,false,1219351907627667456
Twitter for iPhone,It was exactly three years ago today January 20 2017  that I was sworn into office. So appropriate that today is also MLK jr DAY. African-American Unemployment is the LOWEST in the history of our Country by far. Also best Poverty Youth and Employment numbers ever. Great!,01-20-2020 19:59:40,38949,201137,false,1219348788973838336
Twitter for iPhone,...And they say you can add 7% to 10% to all Trump numbers! Who knows? https://t.co/Ta09xrAqUd,01-20-2020 18:53:02,20687,96385,false,1219332022826606592
Twitter for iPhone,Two stone cold losers from Amazon WP. Almost every story is a made up lie just like corrupt pol Shifty Schiff who fraudulently made up my call with Ukraine. Fiction! https://t.co/0Oad0738NG,01-20-2020 18:48:44,15316,60108,false,1219330940461309952
Twitter for iPhone,USA! USA! USA!,01-20-2020 17:04:17,60034,322773,false,1219304652438675456
Twitter for iPhone,Cryin’ Chuck Schumer is now asking for “fairness” when he and the Democrat House members worked together to make sure I got ZERO fairness in the House. So what else is new?,01-20-2020 15:52:48,26691,130235,false,1219286662221651970
Twitter for iPhone,They didn’t want John Bolton and others in the House. They were in too much of a rush. Now they want them all in the Senate. Not supposed to be that way!,01-20-2020 15:47:41,20308,105995,false,1219285375736328192
Twitter for iPhone,The Democrat Party in the Great Commonwealth of Virginia are working hard to take away your 2nd Amendment rights. This is just the beginning. Don’t let it happen VOTE REPUBLICAN in 2020!,01-20-2020 15:43:57,31354,120500,false,1219284434635100162
Twitter for iPhone,A great show! Check it out tonight at 9pm. @FoxNews https://t.co/AH1WHoGbY1,01-20-2020 01:57:49,9507,43964,false,1219076533354037249
Twitter for iPhone,“In the House the President got less due process than the 9-11 terrorists got. This is a corrupt process?” Mark Levin @marklevinshow “Very much so!” @RepDougCollins @FoxNews,01-20-2020 01:16:00,24808,102600,false,1219066007731310593
Twitter for iPhone,I was thrilled to be back in the Great State of Texas tonight where the people are known for being tough strong hardworking loyal and fiercely patriotic — just like America’s incredible Farmers! #AFBF2020 https://t.co/JKkiPxPL0X,01-20-2020 00:27:07,19008,79053,false,1219053709428248576
Twitter for iPhone,Now Mini Mike Bloomberg is critical of Jack Wilson who saved perhaps hundreds of people in a Church because he was carrying a gun and knew how to use it. Jack quickly killed the shooter who was beginning a rampage. Mini is against the 2nd A. His ads are Fake just like him!,01-19-2020 21:12:20,40845,171635,false,1219004689716412416
Twitter for iPhone,I have never seen the Republican Party as Strong and as Unified as it is right now. Thank you!,01-19-2020 18:24:52,36973,247394,false,1218962544372670467
Twitter for iPhone,I will be going to Austin Texas. Leaving soon. Always like (love!) being in the Lone Star State. Speaking to our great Farmers. They hit “paydirt” with our incredible new Trade Deals: CHINA JAPAN MEXICO CANADA SOUTH KOREA and many others!,01-19-2020 17:44:56,25053,132659,false,1218952496388956162
Twitter for iPhone,https://t.co/Efot9QLGDj,01-19-2020 04:30:52,21078,70603,false,1218752661471793153
Twitter for iPhone,“Nancy Pelosi said it’s not a question of proof it’s a question of allegations! Oh really?”  @JudgeJeanine @FoxNews  What a disgrace this Impeachment Scam is for our great Country!,01-19-2020 02:12:28,38227,164179,false,1218717833552711680
Twitter for iPhone,If you listened to the flawed advice of @paulkrugman at the @nytimes a newspaper that was going broke until I came along you would have entirely missed the RECORD BREAKING Stock Market (and other) numbers produced since Election Day 2016. Sorry those are the FACTS.....,01-19-2020 00:52:42,18569,78331,false,1218697758728769536
Twitter for iPhone,....BUT THE BEST IS YET TO COME!,01-19-2020 00:52:28,37403,192497,false,1218697697512820736
Twitter for iPhone,If you listened to the flawed advice of @paulkrugman at the @nytimes a newspaper that was going broke until I came along you would have entirely missed the RECORD BREAKING Stock Market (and other) numbers produced since Election Day 2016. Sorry those are the FACTS....,01-19-2020 00:42:23,1388,4817,false,1218695161758322689
